{
  "$schema": "http://json-schema.org/draft-07/schema#",
  "type": "object",
  "required": ["version", "allowedRoots", "denyPatterns", "maxFilesChangedPerPR"],
  "properties": {
    "version": { "type": "integer" },
    "allowedRoots": { "type": "array", "items": { "type": "string" } },
    "denyPatterns": { "type": "array", "items": { "type": "string" } },
    "maxFilesChangedPerPR": { "type": "integer" }
  }
}

